Welcome to the MySQL monitor.  Commands end with ; or \g.
Your MySQL connection id is 10
Server version: 8.0.28 MySQL Community Server - GPL

Copyright (c) 2000, 2022, Oracle and/or its affiliates.

Oracle is a registered trademark of Oracle Corporation and/or its
affiliates. Other names may be trademarks of their respective
owners.

Type 'help;' or '\h' for help. Type '\c' to clear the current input statement.

mysql> create database AddressBook;
Query OK, 1 row affected (1.75 sec)

mysql> show databases;
+--------------------+
| Database           |
+--------------------+
| addressbook        |
| information_schema |
| mysql              |
| payroll_service    |
| performance_schema |
| sys                |
+--------------------+
6 rows in set (0.59 sec)

mysql> use addressbook;
Database changed
-------------------------------------------------------

#UC2

mysql> create table contacts(
    -> id int auto_increment primary key,
    -> first_name varchar (20) not null,
    -> last_name varchar (20) not null,
    -> address varchar (150) not null,
    -> city varchar (20) not null,
    -> state varchar (20) not null,
    -> zip int not null,
    -> phone_number int not null,
    -> email varchar (30) not null);
Query OK, 0 rows affected (3.97 sec)

mysql> desc contacts;
+--------------+--------------+------+-----+---------+----------------+
| Field        | Type         | Null | Key | Default | Extra          |
+--------------+--------------+------+-----+---------+----------------+
| id           | int          | NO   | PRI | NULL    | auto_increment |
| first_name   | varchar(20)  | NO   |     | NULL    |                |
| last_name    | varchar(20)  | NO   |     | NULL    |                |
| address      | varchar(150) | NO   |     | NULL    |                |
| city         | varchar(20)  | NO   |     | NULL    |                |
| state        | varchar(20)  | NO   |     | NULL    |                |
| zip          | int          | NO   |     | NULL    |                |
| phone_number | int          | NO   |     | NULL    |                |
| email        | varchar(30)  | NO   |     | NULL    |                |
+--------------+--------------+------+-----+---------+----------------+
9 rows in set (0.30 sec)

-------------------------------------------------------

#UC3

mysql> insert into contacts (first_name,last_name,address,city,state,zip,phone_number,email) values ("Anju","Chandran","anj1234","kochi","kerala","123456","90897","anju162@gmail.com");
Query OK, 1 row affected (0.36 sec)

mysql> select * from contacts;
+----+------------+-----------+---------+-------+--------+--------+--------------+-------------------+
| id | first_name | last_name | address | city  | state  | zip    | phone_number | email             |
+----+------------+-----------+---------+-------+--------+--------+--------------+-------------------+
|  1 | Anju       | Chandran  | anj1234 | kochi | kerala | 123456 |        90897 | anju162@gmail.com |
+----+------------+-----------+---------+-------+--------+--------+--------------+-------------------+
1 row in set (0.13 sec)


===================================================
#UC4
#edit contact using first_name
===================================================
mysql> update contacts set phone_number="994662776" where first_name="Anju";
Query OK, 1 row affected (0.20 sec)
Rows matched: 1  Changed: 1  Warnings: 0

mysql> select * from contacts;
+----+------------+-----------+---------+-------+--------+--------+--------------+-------------------+
| id | first_name | last_name | address | city  | state  | zip    | phone_number | email             |
+----+------------+-----------+---------+-------+--------+--------+--------------+-------------------+
|  1 | Anju       | Chandran  | anj1234 | kochi | kerala | 123456 |    994662776 | anju162@gmail.com |
+----+------------+-----------+---------+-------+--------+--------+--------------+-------------------+
1 row in set (0.00 sec)


=================================================
#UC5
#deleting contacts using firstname
=================================================


mysql> insert into contacts(first_name,last_name,address,city,state,zip,phone_number,email) values("Messi","Lionel","aqw4","Barcelona","spain","234536","34586","messi@mail.com");
Query OK, 1 row affected (0.16 sec)

mysql> select * from contacts;
+----+------------+-----------+---------+-----------+--------+--------+--------------+-------------------+
| id | first_name | last_name | address | city      | state  | zip    | phone_number | email             |
+----+------------+-----------+---------+-----------+--------+--------+--------------+-------------------+
|  1 | Anju       | Chandran  | anj1234 | kochi     | kerala | 123456 |    994662776 | anju162@gmail.com |
|  2 | Messi      | Lionel    | aqw4    | Barcelona | spain  | 234536 |        34586 | messi@mail.com    |
+----+------------+-----------+---------+-----------+--------+--------+--------------+-------------------+
2 rows in set (0.01 sec)

mysql> delete from contacts where first_name="messi";
Query OK, 1 row affected (0.16 sec)

mysql> select * from contacts;
+----+------------+-----------+---------+-------+--------+--------+--------------+-------------------+
| id | first_name | last_name | address | city  | state  | zip    | phone_number | email             |
+----+------------+-----------+---------+-------+--------+--------+--------------+-------------------+
|  1 | Anju       | Chandran  | anj1234 | kochi | kerala | 123456 |    994662776 | anju162@gmail.com |
+----+------------+-----------+---------+-------+--------+--------+--------------+-------------------+
1 row in set (0.00 sec)

mysql>